{
  "version": "2.0.0-alpha.1",
  "createdAt": "2026-03-21T06:13:16.839Z",
  "scenePlanRunId": "zeromemory-2026-03-21T06-10-30-clear_weekend_bookstore",
  "lane": "life_record",
  "caption": "纸的边缘皱皱的，忽然想起去年夏天的雨。",
  "hashtags": [
    "#日常切片"
  ],
  "fullCaptionText": "纸的边缘皱皱的，忽然想起去年夏天的雨。\n#日常切片",
  "captionSource": {
    "selectedCandidateId": "caption_02",
    "selectionReason": "这一条最像角色会真的发出来的话。"
  },
  "image": {
    "source": "v2_generated_image",
    "provider": "aliyun-z-image",
    "model": "z-image-turbo",
    "assetId": null,
    "requestStatus": "image_ready",
    "remoteJobId": null,
    "providerRequestId": "b162cbad-14eb-4efb-8d2c-9e1db0c8caf9",
    "altText": "月见璃音的一段日常小瞬间：手指轻触旧笔记边缘的水痕。",
    "imageUrl": "https://dashscope-result-bj.oss-cn-beijing.aliyuncs.com/7d/88/20260321/448165f2/b162cbad-14eb-4efb-8d2c-9e1db0c8caf91814986765.png?Expires=1774679390&OSSAccessKeyId=LTAI5tPxpiCM2hjmWrFXrym1&Signature=aPlWQg8W3RV9MB4NA2Z20bcZDK0%3D",
    "providerEndpoint": "https://dashscope.aliyuncs.com/api/v1/services/aigc/multimodal-generation/generation",
    "assetFilenameHint": "2026-03-21T06-13-12-aliyun-z-image.png",
    "note": "A final image URL has been registered for the current V2 post package."
  },
  "publish": {
    "platform": "instagram",
    "dryRunDefault": true,
    "readiness": "ready_for_dry_run_or_publish",
    "releaseStage": "image_ready",
    "blockers": [],
    "releaseChecklist": [
      "caption_selected",
      "image_ready",
      "alt_text_ready",
      "image_provider_attached",
      "image_request_tracked"
    ]
  }
}